,abstract
226,"Face verification and recognition problems have seen rapid progress in recent
years, however recognition from small size images remains a challenging task
that is inherently intertwined with the task of face super-resolution. Tackling
this problem using multiple frames is an attractive idea, yet requires solving
the alignment problem that is also challenging for low-resolution faces. Here
we present a holistic system for multi-frame recognition, alignment, and
superresolution of faces. Our neural network architecture restores the central
frame of each input sequence additionally taking into account a number of
adjacent frames and making use of sub-pixel movements. We present our results
using the popular dataset for video face recognition (YouTube Faces). We show a
notable improvement of identification score compared to several baselines
including the one based on single-image super-resolution"
227,"The sparse, hierarchical, and modular processing of natural signals is
related to the ability of humans to recognize objects with high accuracy. In
this study, we report a sparse feature processing and encoding method, which
improved the recognition performance of an automated object recognition system.
Randomly distributed localized gradient enhanced features were selected before
employing aggregate functions for representation, where we used a modular and
hierarchical approach to detect the object features. These object features were
combined with a minimum distance classifier, thereby obtaining object
recognition system accuracies of 93% using the Amsterdam library of object
images (ALOI) database, 92% using the Columbia object image library (COIL)-100
database, and 69% using the PASCAL visual object challenge 2007 database. The
object recognition performance was shown to be robust to variations in noise,
object scaling, and object shifts. Finally, a comparison with eight existing
object recognition methods indicated that our new method improved the
recognition accuracy by 10% with ALOI, 8% with the COIL-100 database, and 10%
with the PASCAL visual object challenge 2007 database.Comment: Pages 1"
228,"Human motion recognition is one of the most important branches of
human-centered research activities. In recent years, motion recognition based
on RGB-D data has attracted much attention. Along with the development in
artificial intelligence, deep learning techniques have gained remarkable
success in computer vision. In particular, convolutional neural networks (CNN)
have achieved great success for image-based tasks, and recurrent neural
networks (RNN) are renowned for sequence-based problems. Specifically, deep
learning methods based on the CNN and RNN architectures have been adopted for
motion recognition using RGB-D data. In this paper, a detailed overview of
recent advances in RGB-D-based motion recognition is presented. The reviewed
methods are broadly categorized into four groups, depending on the modality
adopted for recognition: RGB-based, depth-based, skeleton-based and
RGB+D-based. As a survey focused on the application of deep learning to
RGB-D-based motion recognition, we explicitly discuss the advantages and
limitations of existing techniques. Particularly, we highlighted the methods of
encoding spatial-temporal-structural information inherent in video sequence,
and discuss potential directions for future research"
229,"The basic scheme for automated holographic analysis involves an optical system for reconstruction of the three dimensional real image of the droplet field, a spatial scanning system to transport a digitizing X-y image sensor through the real image, and processing algorithms for droplet recognition which establish the droplet sizes and positions. The hardware for system demonstrated includes the expanded and collimated beam from a 5 mW helium-neon laser for hologram reconstruction, an imaging lens for magnification of the real image field, and a video camera and digitizer providing 512-by-512 pixel resolution with 8-bit digitization. A mechanical stage is used to scan the hologram in three dimensional space, maintaining constant image magnification. A test droplet hologram is used for development and testing of the image processing algorithms"
230,"Active Appearance Model (AAM) is a commonly used method for facial image
analysis with applications in face identification and facial expression
recognition. This paper proposes a new approach based on image alignment for
AAM fitting called bidirectional warping. Previous approaches warp either the
input image or the appearance template. We propose to warp both the input
image, using incremental update by an affine transformation, and the appearance
template, using an inverse compositional approach. Our experimental results on
Multi-PIE face database show that the bidirectional approach outperforms
state-of-the-art inverse compositional fitting approaches in extracting
landmark points of faces with shape and pose variations"
231,"Image super-resolution is a process to enhance image resolution. It is widely
used in medical imaging, satellite imaging, target recognition, etc. In this
paper, we conduct continuous modeling and assume that the unknown image
intensity function is defined on a continuous domain and belongs to a space
with a redundant basis. We propose a new iterative model for single image
super-resolution based on an observation: an image is consisted of smooth
components and non-smooth components, and we use two classes of approximated
Heaviside functions (AHFs) to represent them respectively. Due to sparsity of
the non-smooth components, a $L_{1}$ model is employed. In addition, we apply
the proposed iterative model to image patches to reduce computation and
storage. Comparisons with some existing competitive methods show the
effectiveness of the proposed method"
232,"Approaches to goal recognition have progressively relaxed the requirements
about the amount of domain knowledge and available observations, yielding
accurate and efficient algorithms capable of recognizing goals. However, to
recognize goals in raw data, recent approaches require either human engineered
domain knowledge, or samples of behavior that account for almost all actions
being observed to infer possible goals. This is clearly too strong a
requirement for real-world applications of goal recognition, and we develop an
approach that leverages advances in recurrent neural networks to perform goal
recognition as a classification task, using encoded plan traces for training.
We empirically evaluate our approach against the state-of-the-art in goal
recognition with image-based domains, and discuss under which conditions our
approach is superior to previous ones.Comment: Added/Fixed some reference"
233,This work describes the process of face synthesis by image morphing from less expensive 3D sensors such as KINECT that are prone to sensor noise. Its main aim is to create a useful face database for future face recognition studies.Peer reviewe
234,"Deep neural networks have recently achieved tremendous success in image
classification. Recent studies have however shown that they are easily misled
into incorrect classification decisions by adversarial examples. Adversaries
can even craft attacks by querying the model in black-box settings, where no
information about the model is released except its final decision. Such
decision-based attacks usually require lots of queries, while real-world image
recognition systems might actually restrict the number of queries. In this
paper, we propose qFool, a novel decision-based attack algorithm that can
generate adversarial examples using a small number of queries. The qFool method
can drastically reduce the number of queries compared to previous
decision-based attacks while reaching the same quality of adversarial examples.
We also enhance our method by constraining adversarial perturbations in
low-frequency subspace, which can make qFool even more computationally
efficient. Altogether, we manage to fool commercial image recognition systems
with a small number of queries, which demonstrates the actual effectiveness of
our new algorithm in practice"
235,"High resolution satellite image sequences are multidimensional signals
composed of spatio-temporal patterns associated to numerous and various
phenomena. Bayesian methods have been previously proposed in (Heas and Datcu,
2005) to code the information contained in satellite image sequences in a graph
representation using Bayesian methods. Based on such a representation, this
paper further presents a supervised learning methodology of semantics
associated to spatio-temporal patterns occurring in satellite image sequences.
It enables the recognition and the probabilistic retrieval of similar events.
Indeed, graphs are attached to statistical models for spatio-temporal
processes, which at their turn describe physical changes in the observed scene.
Therefore, we adjust a parametric model evaluating similarity types between
graph patterns in order to represent user-specific semantics attached to
spatio-temporal phenomena. The learning step is performed by the incremental
definition of similarity types via user-provided spatio-temporal pattern
examples attached to positive or/and negative semantics. From these examples,
probabilities are inferred using a Bayesian network and a Dirichlet model. This
enables to links user interest to a specific similarity model between graph
patterns. According to the current state of learning, semantic posterior
probabilities are updated for all possible graph patterns so that similar
spatio-temporal phenomena can be recognized and retrieved from the image
sequence. Few experiments performed on a multi-spectral SPOT image sequence
illustrate the proposed spatio-temporal recognition method"
236,"The goal of the present study is to explore the application of deep
convolutional network features to emotion recognition. Results indicate that
they perform similarly to other published models at a best recognition rate of
94.4%, and do so with a single still image rather than a video stream. An
implementation of an affective feedback game is also described, where a
classifier using these features tracks the facial expressions of a player in
real-time.Comment: 6 pages, 8 figures, IEEE styl"
237,"Although deep convolutional neural networks (CNNs) have achieved great
success in computer vision tasks, its real-world application is still impeded
by its voracious demand of computational resources. Current works mostly seek
to compress the network by reducing its parameters or parameter-incurred
computation, neglecting the influence of the input image on the system
complexity. Based on the fact that input images of a CNN contain substantial
redundancy, in this paper, we propose a unified framework, dubbed as ThumbNet,
to simultaneously accelerate and compress CNN models by enabling them to infer
on one thumbnail image. We provide three effective strategies to train
ThumbNet. In doing so, ThumbNet learns an inference network that performs
equally well on small images as the original-input network on large images.
With ThumbNet, not only do we obtain the thumbnail-input inference network that
can drastically reduce computation and memory requirements, but also we obtain
an image downscaler that can generate thumbnail images for generic
classification tasks. Extensive experiments show the effectiveness of ThumbNet,
and demonstrate that the thumbnail-input inference network learned by ThumbNet
can adequately retain the accuracy of the original-input network even when the
input images are downscaled 16 times"
238,"Image Processing, Optimization and Prediction of an Image play a key role in
Computer Science. Image processing provides a way to analyze and identify an
image .Many areas like medical image processing, Satellite images, natural
images and artificial images requires lots of analysis and research on
optimization. In Image Optimization and Prediction we are combining the
features of Query Optimization, Image Processing and Prediction . Image
optimization is used in Pattern analysis, object recognition, in medical Image
processing to predict the type of diseases, in satellite images for predicting
weather forecast, availability of water or mineral etc. Image Processing,
Optimization and analysis is a wide open area for research .Lots of research
has been conducted in the area of Image analysis and many techniques are
available for image analysis but, a single technique is not yet identified for
image analysis and prediction .our research is focused on identifying a global
technique for image analysis and Prediction.Comment: Pages: 08 Figures: 02, Proceedings of International Conferences
  CAAM-09 BITS, Durg, India, 10 Jan 200"
239,"The automatic recognition of sound events by computers is an important aspect of emerging applications such as automated surveillance, machine hearing and auditory scene understanding. Recent advances in machine learning, as well as in computational models of the human auditory system, have contributed to advances in this increasingly popular research field. Robust sound event classification, the ability to recognise sounds under real-world noisy conditions, is an especially challenging task. Classification methods translated from the speech recognition domain, using features such as mel-frequency cepstral coefficients, have been shown to perform reasonably well for the sound event classification task, although spectrogram-based or auditory image analysis techniques reportedly achieve superior performance in noise.

This paper outlines a sound event classification framework that compares auditory image front end features with spectrogram image-based front end features, using support vector machine and deep neural network classifiers. Performance is evaluated on a standard robust classification task in different levels of corrupting noise, and with several system enhancements, and shown to compare very well with current state-of-the-art classification techniques"
240,"The topic of semantic segmentation has witnessed considerable progress due to
the powerful features learned by convolutional neural networks (CNNs). The
current leading approaches for semantic segmentation exploit shape information
by extracting CNN features from masked image regions. This strategy introduces
artificial boundaries on the images and may impact the quality of the extracted
features. Besides, the operations on the raw image domain require to compute
thousands of networks on a single image, which is time-consuming. In this
paper, we propose to exploit shape information via masking convolutional
features. The proposal segments (e.g., super-pixels) are treated as masks on
the convolutional feature maps. The CNN features of segments are directly
masked out from these maps and used to train classifiers for recognition. We
further propose a joint method to handle objects and ""stuff"" (e.g., grass, sky,
water) in the same framework. State-of-the-art results are demonstrated on
benchmarks of PASCAL VOC and new PASCAL-CONTEXT, with a compelling
computational speed.Comment: IEEE Conference on Computer Vision and Pattern Recognition (CVPR),
  201"
241,"Printed text recognition is an important problem for industrial OCR systems.
Printed text is constructed in a standard procedural fashion in most settings.
We develop a mathematical model for this process that can be applied to the
backward inference problem of text recognition from an image. Through ablation
experiments we show that this model is realistic and that a multi-task
objective setting can help to stabilize estimation of its free parameters,
enabling use of conventional deep learning methods. Furthermore, by directly
modeling the geometric perturbations of text synthesis we show that our model
can help recover missing characters from incomplete text regions, the bane of
multicomponent OCR systems, enabling recognition even when the detection
returns incomplete information"
242,"The problem of domain generalization is to take knowledge acquired from a
number of related domains where training data is available, and to then
successfully apply it to previously unseen domains. We propose a new feature
learning algorithm, Multi-Task Autoencoder (MTAE), that provides good
generalization performance for cross-domain object recognition.
  Our algorithm extends the standard denoising autoencoder framework by
substituting artificially induced corruption with naturally occurring
inter-domain variability in the appearance of objects. Instead of
reconstructing images from noisy versions, MTAE learns to transform the
original image into analogs in multiple related domains. It thereby learns
features that are robust to variations across domains. The learnt features are
then used as inputs to a classifier.
  We evaluated the performance of the algorithm on benchmark image recognition
datasets, where the task is to learn features from multiple datasets and to
then predict the image label from unseen datasets. We found that (denoising)
MTAE outperforms alternative autoencoder-based models as well as the current
state-of-the-art algorithms for domain generalization.Comment: accepted in ICCV 201"
243,"Deep learning using convolutional neural networks (CNNs) is quickly becoming
the state-of-the-art for challenging computer vision applications. However,
deep learning's power consumption and bandwidth requirements currently limit
its application in embedded and mobile systems with tight energy budgets. In
this paper, we explore the energy savings of optically computing the first
layer of CNNs. To do so, we utilize bio-inspired Angle Sensitive Pixels (ASPs),
custom CMOS diffractive image sensors which act similar to Gabor filter banks
in the V1 layer of the human visual cortex. ASPs replace both image sensing and
the first layer of a conventional CNN by directly performing optical edge
filtering, saving sensing energy, data bandwidth, and CNN FLOPS to compute. Our
experimental results (both on synthetic data and a hardware prototype) for a
variety of vision tasks such as digit recognition, object recognition, and face
identification demonstrate using ASPs while achieving similar performance
compared to traditional deep learning pipelines.Comment: Presented in CVPR 2016 (oral), 10 pages, 12 figures. This new version
  corrects the comparison between imaging power for ASPs and a regular image
  senso"
244,"Recognition across domains has recently become an active topic in the
research community. However, it has been largely overlooked in the problem of
recognition in new unseen domains. Under this condition, the delivered deep
network models are unable to be updated, adapted, or fine-tuned. Therefore,
recent deep learning techniques, such as domain adaptation, feature
transferring, and fine-tuning, cannot be applied. This paper presents a novel
approach to the problem of domain generalization in the context of deep
learning. The proposed method is evaluated on different datasets in various
problems, i.e. (i) digit recognition on MNIST, SVHN, and MNIST-M, (ii) face
recognition on Extended Yale-B, CMU-PIE and CMU-MPIE, and (iii) pedestrian
recognition on RGB and Thermal image datasets. The experimental results show
that our proposed method consistently improves performance accuracy. It can
also be easily incorporated with any other CNN frameworks within an end-to-end
deep network design for object detection and recognition problems to improve
their performance.Comment: Accepted to Computer and Robot Vision 2020. arXiv admin note:
  substantial text overlap with arXiv:1812.0340"
245,"In a real-world setting, visual recognition systems can be brought to make
predictions for images belonging to previously unknown class labels. In order
to make semantically meaningful predictions for such inputs, we propose a
two-step approach that utilizes information from knowledge graphs. First, a
knowledge-graph representation is learned to embed a large set of entities into
a semantic space. Second, an image representation is learned to embed images
into the same space. Under this setup, we are able to predict structured
properties in the form of relationship triples for any open-world image. This
is true even when a set of labels has been omitted from the training protocols
of both the knowledge graph and image embeddings. Furthermore, we append this
learning framework with appropriate smoothness constraints and show how prior
knowledge can be incorporated into the model. Both these improvements combined
increase performance for visual recognition by a factor of six compared to our
baseline. Finally, we propose a new, extended dataset which we use for
experiments"
246,"Fingerprint recognition has drawn a lot of attention during last decades.
Different features and algorithms have been used for fingerprint recognition in
the past. In this paper, a powerful image representation called scattering
transform/network, is used for recognition. Scattering network is a
convolutional network where its architecture and filters are predefined wavelet
transforms. The first layer of scattering representation is similar to sift
descriptors and the higher layers capture higher frequency content of the
signal. After extraction of scattering features, their dimensionality is
reduced by applying principal component analysis (PCA). At the end, multi-class
SVM is used to perform template matching for the recognition task. The proposed
scheme is tested on a well-known fingerprint database and has shown promising
results with the best accuracy rate of 98\%.Comment: IEEE Signal Processing in Medicine and Biology Symposium, 201"
247,"Biometric time and attendance system is one of the most successful
applications of biometric technology. One of the main advantage of a biometric
time and attendance system is it avoids ""buddy-punching"". Buddy punching was a
major loophole which will be exploiting in the traditional time attendance
systems. Fingerprint recognition is an established field today, but still
identifying individual from a set of enrolled fingerprints is a time taking
process. Most fingerprint-based biometric systems store the minutiae template
of a user in the database. It has been traditionally assumed that the minutiae
template of a user does not reveal any information about the original
fingerprint. This belief has now been shown to be false; several algorithms
have been proposed that can reconstruct fingerprint images from minutiae
templates. In this paper, a novel fingerprint reconstruction algorithm is
proposed to reconstruct the phase image, which is then converted into the
grayscale image. The proposed reconstruction algorithm reconstructs the phase
image from minutiae. The proposed reconstruction algorithm is used to automate
the whole process of taking attendance, manually which is a laborious and
troublesome work and waste a lot of time, with its managing and maintaining the
records for a period of time is also a burdensome task. The proposed
reconstruction algorithm has been evaluated with respect to the success rates
of type-I attack (match the reconstructed fingerprint against the original
fingerprint) and type-II attack (match the reconstructed fingerprint against
different impressions of the original fingerprint) using a commercial
fingerprint recognition system. Given the reconstructed image from our
algorithm, we show that both types of attacks can be effectively launched
against a fingerprint recognition system.Comment: 6pages,5figure"
248,"Attention-based learning for fine-grained image recognition remains a
challenging task, where most of the existing methods treat each object part in
isolation, while neglecting the correlations among them. In addition, the
multi-stage or multi-scale mechanisms involved make the existing methods less
efficient and hard to be trained end-to-end. In this paper, we propose a novel
attention-based convolutional neural network (CNN) which regulates multiple
object parts among different input images. Our method first learns multiple
attention region features of each input image through the one-squeeze
multi-excitation (OSME) module, and then apply the multi-attention multi-class
constraint (MAMC) in a metric learning framework. For each anchor feature, the
MAMC functions by pulling same-attention same-class features closer, while
pushing different-attention or different-class features away. Our method can be
easily trained end-to-end, and is highly efficient which requires only one
training stage. Moreover, we introduce Dogs-in-the-Wild, a comprehensive dog
species dataset that surpasses similar existing datasets by category coverage,
data volume and annotation quality. This dataset will be released upon
acceptance to facilitate the research of fine-grained image recognition.
Extensive experiments are conducted to show the substantial improvements of our
method on four benchmark datasets"
