,abstract
137,"In this paper, we introduce a simple but quite effective recognition
framework dubbed D-PCN, aiming at enhancing feature extracting ability of CNN.
The framework consists of two parallel CNNs, a discriminator and an extra
classifier which takes integrated features from parallel networks and gives
final prediction. The discriminator is core which drives parallel networks to
focus on different regions and learn different representations. The
corresponding training strategy is introduced to ensures utilization of
discriminator. We validate D-PCN with several CNN models on benchmark datasets:
CIFAR-100, and ImageNet, D-PCN enhances all models. In particular it yields
state of the art performance on CIFAR-100 compared with related works. We also
conduct visualization experiment on fine-grained Stanford Dogs dataset to
verify our motivation. Additionally, we apply D-PCN for segmentation on PASCAL
VOC 2012 and also find promotion.Comment: Accepted by ACCV 201"
138,"Face recognition approaches that are based on deep convolutional neural
networks (CNN) have been dominating the field. The performance improvements
they have provided in the so called in-the-wild datasets are significant,
however, their performance under image quality degradations have not been
assessed, yet. This is particularly important, since in real-world face
recognition applications, images may contain various kinds of degradations due
to motion blur, noise, compression artifacts, color distortions, and occlusion.
In this work, we have addressed this problem and analyzed the influence of
these image degradations on the performance of deep CNN-based face recognition
approaches using the standard LFW closed-set identification protocol. We have
evaluated three popular deep CNN models, namely, the AlexNet, VGG-Face, and
GoogLeNet. Results have indicated that blur, noise, and occlusion cause a
significant decrease in performance, while deep CNN models are found to be
robust to distortions, such as color distortions and change in color balance.Comment: 8 pages, 3 figure"
139,"Many recent news headlines have labeled face recognition technology as biased
or racist. We report on a methodical investigation into differences in face
recognition accuracy between African-American and Caucasian image cohorts of
the MORPH dataset. We find that, for all four matchers considered, the impostor
and the genuine distributions are statistically significantly different between
cohorts. For a fixed decision threshold, the African-American image cohort has
a higher false match rate and a lower false non-match rate. ROC curves compare
verification rates at the same false match rate, but the different cohorts
achieve the same false match rate at different thresholds. This means that ROC
comparisons are not relevant to operational scenarios that use a fixed decision
threshold. We show that, for the ResNet matcher, the two cohorts have
approximately equal separation of impostor and genuine distributions. Using
ICAO compliance as a standard of image quality, we find that the initial image
cohorts have unequal rates of good quality images. The ICAO-compliant subsets
of the original image cohorts show improved accuracy, with the main effect
being to reducing the low-similarity tail of the genuine distributions.Comment: Paper will appear in the BEFA workshop at CVPR 201"
140,"Statistical pattern recognition methods based on the Coherence Length Diagram
(CLD) have been proposed for medical image analyses, such as quantitative
characterisation of human skin textures, and for polarized light microscopy of
liquid crystal textures. Further investigations are made on image maps
originated from such diagram and some examples related to irregularity of
microstructures are shown"
141,"With the increasing number of computer graphics, image processing, and pattern recognition applications, economical storage, efficient representation and manipulation, and powerful and flexible query languages for retrieval of image data are of paramount importance. These and related issues pertinent to image data bases are examined"
142,"While recent deep neural network models have achieved promising results on
the image captioning task, they rely largely on the availability of corpora
with paired image and sentence captions to describe objects in context. In this
work, we propose the Deep Compositional Captioner (DCC) to address the task of
generating descriptions of novel objects which are not present in paired
image-sentence datasets. Our method achieves this by leveraging large object
recognition datasets and external text corpora and by transferring knowledge
between semantically similar concepts. Current deep caption models can only
describe objects contained in paired image-sentence corpora, despite the fact
that they are pre-trained with large object recognition datasets, namely
ImageNet. In contrast, our model can compose sentences that describe novel
objects and their interactions with other objects. We demonstrate our model's
ability to describe novel concepts by empirically evaluating its performance on
MSCOCO and show qualitative results on ImageNet images of objects for which no
paired image-caption data exist. Further, we extend our approach to generate
descriptions of objects in video clips. Our results show that DCC has distinct
advantages over existing image and video captioning approaches for generating
descriptions of new objects in context"
143,"Image data has a great potential of helping post-earthquake visual
inspections of civil engineering structures due to the ease of data acquisition
and the advantages in capturing visual information. A variety of techniques
have been applied to detect damages automatically from a close-up image of a
structural component. However, the application of the automatic damage
detection methods become increasingly difficult when the image includes
multiple components from different structures. To reduce the inaccurate false
positive alarms, critical structural components need to be recognized first,
and the damage alarms need to be cleaned using the component recognition
results. To achieve the goal, this study aims at recognizing and extracting
bridge components from images of urban scenes. The bridge component recognition
begins with pixel-wise classifications of an image into 10 scene classes. Then,
the original image and the scene classification results are combined to
classify the image pixels into five component classes. The multi-scale
convolutional neural networks (multi-scale CNNs) are used to perform pixel-wise
classification, and the classification results are post-processed by averaging
within superpixels and smoothing by conditional random fields (CRFs). The
performance of the bridge component extraction is tested in terms of accuracy
and consistency"
144,"Recently regression analysis becomes a popular tool for face recognition. The
existing regression methods all use the one-dimensional pixel-based error
model, which characterizes the representation error pixel by pixel individually
and thus neglects the whole structure of the error image. We observe that
occlusion and illumination changes generally lead to a low-rank error image. To
make use of this low-rank structural information, this paper presents a
two-dimensional image matrix based error model, i.e. matrix regression, for
face representation and classification. Our model uses the minimal nuclear norm
of representation error image as a criterion, and the alternating direction
method of multipliers method to calculate the regression coefficients. Compared
with the current regression methods, the proposed Nuclear Norm based Matrix
Regression (NMR) model is more robust for alleviating the effect of
illumination, and more intuitive and powerful for removing the structural noise
caused by occlusion. We experiment using four popular face image databases, the
Extended Yale B database, the AR database, the Multi-PIE and the FRGC database.
Experimental results demonstrate the performance advantage of NMR over the
state-of-the-art regression based face recognition methods.Comment: 30 page"
145,"Recently, it has been shown that performance of a face recognition system depends on the quality of both face images participating in the recognition process: the reference and the test image. In the context of forensic face recognition, this observation has two implications: a) the quality of the trace (extracted from CCTV footage) constrains the performance achievable using a particular face recognition system; b) the quality of the suspect reference set (to which the trace is matched against) can be judiciously chosen to approach optimal recognition performance under such a constraint. Motivated by these recent findings, we propose a framework for forensic face recognition that is based on calibrating the recognition performance for the quality of pairs of images. The application of this framework to several mock-up forensic cases, created entirely from the MultiPIE dataset, shows that optimal recognition performance, under such a constraint, can be achieved by matching the quality (pose, illumination, and, imaging device) of the reference set to that of the trace. This improvement in recognition performance helps reduce the rate of misleading interpretation of the evidence"
146,"Action recognition from still images is an important task of computer vision
applications such as image annotation, robotic navigation, video surveillance
and several others. Existing approaches mainly rely on either bag-of-feature
representations or articulated body-part models. However, the relationship
between the action and the image segments is still substantially unexplored.
For this reason, in this paper we propose to approach action recognition by
leveraging an intermediate layer of ""superpixels"" whose latent classes can act
as attributes of the action. In the proposed approach, the action class is
predicted by a structural model(learnt by Latent Structural SVM) based on
measurements from the image superpixels and their latent classes. Experimental
results over the challenging Stanford 40 Actions dataset report a significant
average accuracy of 74.06% for the positive class and 88.50% for the negative
class, giving evidence to the performance of the proposed approach.Comment: To appear in the Proceedings of the IEEE International Conference on
  Image Processing. Copyright 2015 IEEE. Please be aware of your obligations
  with respect to copyrighted materia"
147,"In the recent time deep learning has achieved huge popularity due to its
performance in various machine learning algorithms. Deep learning as
hierarchical or structured learning attempts to model high level abstractions
in data by using a group of processing layers. The foundation of deep learning
architectures is inspired by the understanding of information processing and
neural responses in human brain. The architectures are created by stacking
multiple linear or non-linear operations. The article mainly focuses on the
state-of-art deep learning models and various real world applications specific
training methods. Selecting optimal architecture for specific problem is a
challenging task, at a closing stage of the article we proposed optimal
approach to deep convolutional architecture for the application of image
recognition"
148,"We present a new circuit for non-Boolean recognition of binary images.
Employing all-spin logic (ASL) devices, we design logic comparators and
non-Boolean decision blocks for compact and efficient computation. By
manipulation of fan-in number in different stages of the circuit, the structure
can be extended for larger training sets or larger images. Operating based on
the mainly similarity idea, the system is capable of constructing a mean image
and compare it with a separate input image within a short decision time. Taking
advantage of the non-volatility of ASL devices, the proposed circuit is capable
of hybrid memory/logic operation. Compared with existing CMOS pattern
recognition circuits, this work achieves a smaller footprint, lower power
consumption, faster decision time and a lower operational voltage. To the best
of our knowledge, this is the first fully spin-based complete pattern
recognition circuit demonstrated using spintronic devices.Comment: This article is accepted to appear in IEEE Transactions on
  Nanotechnolog"
149,"Emotion is a key element in user-generated videos. However, it is difficult
to understand emotions conveyed in such videos due to the complex and
unstructured nature of user-generated content and the sparsity of video frames
expressing emotion. In this paper, for the first time, we study the problem of
transferring knowledge from heterogeneous external sources, including image and
textual data, to facilitate three related tasks in understanding video emotion:
emotion recognition, emotion attribution and emotion-oriented summarization.
Specifically, our framework (1) learns a video encoding from an auxiliary
emotional image dataset in order to improve supervised video emotion
recognition, and (2) transfers knowledge from an auxiliary textual corpora for
zero-shot recognition of emotion classes unseen during training. The proposed
technique for knowledge transfer facilitates novel applications of emotion
attribution and emotion-oriented summarization. A comprehensive set of
experiments on multiple datasets demonstrate the effectiveness of our
framework.Comment: 13 pages, 11 figures. Published at the IEEE Transactions on Affective
  Computin"
150,"In recent years, the widespread use of deep neural networks (DNNs) has
facilitated great improvements in performance for computer vision tasks like
image classification and object recognition. In most realistic computer vision
applications, an input image undergoes some form of image distortion such as
blur and additive noise during image acquisition or transmission. Deep networks
trained on pristine images perform poorly when tested on such distortions. In
this paper, we evaluate the effect of image distortions like Gaussian blur and
additive noise on the activations of pre-trained convolutional filters. We
propose a metric to identify the most noise susceptible convolutional filters
and rank them in order of the highest gain in classification accuracy upon
correction. In our proposed approach called DeepCorrect, we apply small stacks
of convolutional layers with residual connections, at the output of these
ranked filters and train them to correct the worst distortion affected filter
activations, whilst leaving the rest of the pre-trained filter outputs in the
network unchanged. Performance results show that applying DeepCorrect models
for common vision tasks like image classification (ImageNet), object
recognition (Caltech-101, Caltech-256) and scene classification (SUN-397),
significantly improves the robustness of DNNs against distorted images and
outperforms other alternative approaches..Comment: Accepted to IEEE Transactions on Image Processing, April 2019. For
  associated code, see https://github.com/tsborkar/DeepCorrec"
151,"Motion blur, out of focus, insufficient spatial resolution, lossy compression
and many other factors can all cause an image to have poor quality. However,
image quality is a largely ignored issue in traditional pattern recognition
literature. In this paper, we use face detection and recognition as case
studies to show that image quality is an essential factor which will affect the
performances of traditional algorithms. We demonstrated that it is not the
image quality itself that is the most important, but rather the quality of the
images in the training set should have similar quality as those in the testing
set. To handle real-world application scenarios where images with different
kinds and severities of degradation can be presented to the system, we have
developed a quality classified image analysis framework to deal with images of
mixed qualities adaptively. We use deep neural networks first to classify
images based on their quality classes and then design a separate face detector
and recognizer for images in each quality class. We will present experimental
results to show that our quality classified framework can accurately classify
images based on the type and severity of image degradations and can
significantly boost the performances of state-of-the-art face detector and
recognizer in dealing with image datasets containing mixed quality images.Comment: 6 page"
152,"Vehicle tracking is an integral part of intelligent traffic management
systems. Previous implementations of vehicle tracking used Global Positioning
System(GPS) based systems that gave location of the vehicle of an individual on
their smartphones.The proposed system uses a novel approach to vehicle tracking
using Vehicle License plate detection and recognition (VLPR) technique, which
can be integrated on a large scale with traffic management systems. Initial
methods of implementing VLPR used simple image processing techniques which were
quite experimental and heuristic. With the onset of Deep learning and Computer
Vision, one can create robust VLPR systems that can produce results close to
human efficiency. Previous implementations, based on deep learning, made use of
object detection and support vector machines for detection and a heuristic
image processing based approach for recognition. The proposed system makes use
of scene text detection model architecture for License plate detection and for
recognition it uses the Optical character recognition engine (OCR) Tesseract.
The proposed system obtained extraordinary results when it was tested on a
highway video using NVIDIA Ge-force RTX 2080ti GPU, results were obtained at a
speed of 30 frames per second with accuracy close to human.Comment: 6 pages, 13 figure"
153,"The recognition of 3-D objects from sequences of their 2-D views is modeled by a neural architecture, called VIEWNET that uses View Information Encoded With NETworks. VIEWNET illustrates how several types of noise and varialbility in image data can be progressively removed while incornplcte image features are restored and invariant features are discovered using an appropriately designed cascade of processing stages. VIEWNET first processes 2-D views of 3-D objects using the CORT-X 2 filter, which discounts the illuminant, regularizes and completes figural boundaries, and removes noise from the images. Boundary regularization and cornpletion are achieved by the same mechanisms that suppress image noise. A log-polar transform is taken with respect to the centroid of the resulting figure and then re-centered to achieve 2-D scale and rotation invariance. The invariant images are coarse coded to further reduce noise, reduce foreshortening effects, and increase generalization. These compressed codes are input into a supervised learning system based on the fuzzy ARTMAP algorithm. Recognition categories of 2-D views are learned before evidence from sequences of 2-D view categories is accumulated to improve object recognition. Recognition is studied with noisy and clean images using slow and fast learning. VIEWNET is demonstrated on an MIT Lincoln Laboratory database of 2-D views of jet aircraft with and without additive noise. A recognition rate of 90% is achieved with one 2-D view category and of 98.5% correct with three 2-D view categories.National Science Foundation (IRI 90-24877); Office of Naval Research (N00014-91-J-1309, N00014-91-J-4100, N00014-92-J-0499); Air Force Office of Scientific Research (F9620-92-J-0499, 90-0083"
154,"Thermal infrared (IR) images represent the heat patterns emitted from hot
object and they do not consider the energies reflected from an object. Objects
living or non-living emit different amounts of IR energy according to their
body temperature and characteristics. Humans are homoeothermic and hence
capable of maintaining constant temperature under different surrounding
temperature. Face recognition from thermal (IR) images should focus on changes
of temperature on facial blood vessels. These temperature changes can be
regarded as texture features of images and wavelet transform is a very good
tool to analyze multi-scale and multi-directional texture. Wavelet transform is
also used for image dimensionality reduction, by removing redundancies and
preserving original features of the image. The sizes of the facial images are
normally large. So, the wavelet transform is used before image similarity is
measured. Therefore this paper describes an efficient approach of human face
recognition based on wavelet transform from thermal IR images. The system
consists of three steps. At the very first step, human thermal IR face image is
preprocessed and the face region is only cropped from the entire image.
Secondly, Haar wavelet is used to extract low frequency band from the cropped
face region. Lastly, the image classification between the training images and
the test images is done, which is based on low-frequency components. The
proposed approach is tested on a number of human thermal infrared face images
created at our own laboratory and Terravic Facial IR Database. Experimental
results indicated that the thermal infra red face images can be recognized by
the proposed system effectively. The maximum success of 95% recognition has
been achieved.Comment: 12 pages. arXiv admin note: substantial text overlap with
  arXiv:1309.100"
155,"In this paper, we propose a new unsupervised feature learning framework,
namely Deep Sparse Coding (DeepSC), that extends sparse coding to a multi-layer
architecture for visual object recognition tasks. The main innovation of the
framework is that it connects the sparse-encoders from different layers by a
sparse-to-dense module. The sparse-to-dense module is a composition of a local
spatial pooling step and a low-dimensional embedding process, which takes
advantage of the spatial smoothness information in the image. As a result, the
new method is able to learn several levels of sparse representation of the
image which capture features at a variety of abstraction levels and
simultaneously preserve the spatial smoothness between the neighboring image
patches. Combining the feature representations from multiple layers, DeepSC
achieves the state-of-the-art performance on multiple object recognition tasks.Comment: 9 pages, submitted to ICL"
156,"We propose a novel approach to template based face recognition. Our dual goal
is to both increase recognition accuracy and reduce the computational and
storage costs of template matching. To do this, we leverage on an approach
which was proven effective in many other domains, but, to our knowledge, never
fully explored for face images: average pooling of face photos. We show how
(and why!) the space of a template's images can be partitioned and then pooled
based on image quality and head pose and the effect this has on accuracy and
template size. We perform extensive tests on the IJB-A and Janus CS2 template
based face identification and verification benchmarks. These show that not only
does our approach outperform published state of the art despite requiring far
fewer cross template comparisons, but also, surprisingly, that image pooling
performs on par with deep feature pooling.Comment: Appeared in the IEEE Computer Society Workshop on Biometrics, IEEE
  Conf. on Computer Vision and Pattern Recognition (CVPR), June, 201"
157,"Inspired by recent successes in neural machine translation and image caption
generation, we present an attention based encoder decoder model (AED) to
recognize Vietnamese Handwritten Text. The model composes of two parts: a
DenseNet for extracting invariant features, and a Long Short-Term Memory
network (LSTM) with an attention model incorporated for generating output text
(LSTM decoder), which are connected from the CNN part to the attention model.
The input of the CNN part is a handwritten text image and the target of the
LSTM decoder is the corresponding text of the input image. Our model is trained
end-to-end to predict the text from a given input image since all the parts are
differential components. In the experiment section, we evaluate our proposed
AED model on the VNOnDB-Word and VNOnDB-Line datasets to verify its efficiency.
The experiential results show that our model achieves 12.30% of word error rate
without using any language model. This result is competitive with the
handwriting recognition system provided by Google in the Vietnamese Online
Handwritten Text Recognition competition"
158,"This paper highlights the factors to consider in entering into sports agreements including the tax treatment applied to image rights and the recent update and commentary of the Inland Revenue (HRMC) to their capital gains tax manual on the taxation of image rights.  The commentary of HRMC on image rights is yet another indication that, although traditional common law remedies will evolve further in the light of the growing commercialisation of image rights, a formal legislative or jurisprudential recognition of personality rights remains unlikely in the near future in the UK"
